"Introduction to Algorithms",,,introduction-to-algorithms/_introduction-to-algorithms,Reading,
"Database Systems",,,database-systems/_database-systems,Reading,
"Performance Engineering of Software Systems",,,performance-engineering-of-software-systems/_performance-engineering-of-software-systems,Reading,
"The Modern Algorithmic Toolbox",,,the-modern-algorithmic-toolbox/_the-modern-algorithmic-toolbox,Reading,
"An Introduction to Computer Networks",,,an-introduction-to-computer-networks/_an-introduction-to-computer-networks,Reading,
"Finance Theory I",,,finance-theory-i/_finance-theory-i,Reading,
